DEPARTMENT/OFFICES,NAME,ADDRESS,CONTACT NUMBER,EMAIL ADDRESS
City Mayor's Office,Hon. Mayor XXX, Iligan City,221-0000 / 221-0000,testing@gmail.com
Chief of Staff Office,Name 123, Iligan City,221-0000,testing@gmail.com
City Administrator's Office,Darwin J. Manubag, Iligan City,221-0000 / 221-0000 / 221-0000,testing@gmail.com
City Vice Mayor's Office,"Hon. Marianito ""Dodong"" Alemania", Iligan City,222-0000,testing@gmail.com
City Councilor,Bernard  Y. Pacaña, Iligan City,0000-000-0000,testing@gmail.com
City Councilor,Simplicio N. Larrazabal III, Iligan City,221-0000,testing@gmail.com
